<?xml version="1.0" encoding="UTF-8"?>
<xs:schema xmlns:xs="http://www.w3.org/2001/XMLSchema" elementFormDefault="qualified">
    <xs:complexType name="cuentaType">
        <xs:sequence>
            <xs:element name="nombre" type="xs:string"/>
            <xs:element name="correo" type="xs:string"/>
            <xs:element name="telefono">
                <xs:complexType>
                    <xs:simpleContent>
                        <xs:extension base="xs:string">
                            <xs:attribute name="tipo" type="xs:string"/>
                        </xs:extension>
                    </xs:simpleContent>
                </xs:complexType>
            </xs:element>
        </xs:sequence>
        <xs:attribute name="id" type="xs:string"/>
        <xs:attribute name="plan" type="xs:string"/>
        <xs:attribute name="fechaIni" type="xs:string"/>
        <xs:attribute name="fechaFin" type="xs:string"/>
    </xs:complexType>
    <xs:complexType name="spotifyType">
        <xs:sequence>
            <xs:element name="cuenta" type="cuentaType" maxOccurs="unbounded"/>
        </xs:sequence>
    </xs:complexType>
    <xs:element name="spotify" type="spotifyType"/>
</xs:schema>
